{
  "allocationPolicy": {
    "allocateOnlyAfterSixTaskPass": true,
    "candidateKeysArePublicIds": false,
    "firstPublicId": 3089,
    "requiredAllocationCount": 28,
    "retiredIdsMayBeRebound": false,
    "retiredPublicIds": [
      3009,
      3012,
      3013,
      3014,
      3015,
      3018,
      3020,
      3026,
      3034,
      3035,
      3037,
      3043,
      3044,
      3047,
      3055,
      3056,
      3057,
      3059,
      3060,
      3061,
      3065,
      3071,
      3072,
      3073,
      3078,
      3079,
      3080,
      3086
    ],
    "writesPluginAuthorityItems": false
  },
  "authorityEffect": "candidate-evidence-only-never-install-authority",
  "baseline": {
    "commit": "0a53fb55bea101816fa226bb964ae2bed71c343b",
    "lockfileSha256": "6cc109a574218f51762474455c8d72e5f7c2625aedf25e85569dba1af7adcef0",
    "tag": "dsh-v0.1.2-alpha.2",
    "tree": "64ccbfa8e0caa4711cd4a75717ef9e022657961b"
  },
  "candidates": [
    {
      "candidateKey": "FuRongJun-1999/dsh-memory",
      "candidateToken": "replacement-01-0058c24bdf33f957c782",
      "distributionClass": "direct-upstream-exact",
      "packageName": "@furongjun1999/dsh-memory",
      "packageVersion": "0.4.2",
      "rank": 1,
      "runtimeInput": null,
      "source": {
        "commit": "cbafcef78320d37353634e13e0af1ad6e4fb7e52",
        "exactCoordinate": "npm:@furongjun1999/dsh-memory@0.4.2",
        "repository": "https://github.com/FuRongJun-1999/dsh-memory.git",
        "sourceSubdir": ".",
        "tree": "e90fca6daebeb85081719b3ad823e4a793a8cf98"
      },
      "status": "runtime-input-pending"
    },
    {
      "candidateKey": "ADWMC/helm-d#packages/helmd",
      "candidateToken": "replacement-02-e6dafcfeb06fd2199355",
      "distributionClass": "direct-upstream-exact",
      "packageName": "@dsh-security/helmd",
      "packageVersion": "0.2.1",
      "rank": 2,
      "runtimeInput": null,
      "source": {
        "commit": "5bf19263e60f369563df45ce92b0324481f67033",
        "exactCoordinate": "https://github.com/ADWMC/helm-d/releases/download/v0.2.1/dsh-security-helmd-0.2.1.tgz",
        "repository": "https://github.com/ADWMC/helm-d.git",
        "sourceSubdir": "packages/helmd",
        "tree": "94bcd951f2baf92c4a086e9540eeafd0abbe22fe"
      },
      "status": "runtime-input-pending"
    },
    {
      "candidateKey": "DeepTrial/dsh-bash-rtk",
      "candidateToken": "replacement-03-c10fb965e4b2d737210e",
      "distributionClass": "direct-upstream-exact",
      "packageName": "@deeptrial/dsh-bash-rtk",
      "packageVersion": "0.1.1",
      "rank": 3,
      "runtimeInput": null,
      "source": {
        "commit": "2ed878009f2ac2045fc014048fe387f5fe883263",
        "exactCoordinate": "npm:@deeptrial/dsh-bash-rtk@0.1.1",
        "repository": "https://github.com/DeepTrial/dsh-bash-rtk.git",
        "sourceSubdir": ".",
        "tree": "0dfdd7561acc457c12186f5a2262168af8115ea0"
      },
      "status": "runtime-input-pending"
    },
    {
      "candidateKey": "zhujunpeng12/dsh-memory-system",
      "candidateToken": "replacement-04-fbeaf343ce480ef81e74",
      "distributionClass": "direct-upstream-exact",
      "packageName": "dsh-memory-system",
      "packageVersion": "0.1.1",
      "rank": 4,
      "runtimeInput": null,
      "source": {
        "commit": "71d48bd105a91d0196e6c7489839dabd049182d4",
        "exactCoordinate": "https://github.com/zhujunpeng12/dsh-memory-system/releases/download/v0.1.1/zhujunpeng12-dsh-memory-system-0.1.1.tgz",
        "repository": "https://github.com/zhujunpeng12/dsh-memory-system.git",
        "sourceSubdir": ".",
        "tree": "a6c6183fc9e0aff4a8391fd1b08a2febec7a57a2"
      },
      "status": "runtime-input-pending"
    },
    {
      "candidateKey": "00080000/dsh-project-memory",
      "candidateToken": "replacement-05-d89c82531ed268c0d9bc",
      "distributionClass": "direct-upstream-exact",
      "packageName": "@yolk_vat-y/dsh-project-memory",
      "packageVersion": "0.3.3",
      "rank": 5,
      "runtimeInput": null,
      "source": {
        "commit": "40089e1449d561eb2fd9c10aaa2f2968a0ae0b46",
        "exactCoordinate": "npm:@yolk_vat-y/dsh-project-memory@0.3.3",
        "repository": "https://github.com/00080000/dsh-project-memory.git",
        "sourceSubdir": ".",
        "tree": "a73aa3f911ecfdd2ba462231a9d14f1c79483d1e"
      },
      "status": "runtime-input-pending"
    },
    {
      "candidateKey": "tafcear/kimi-tide#packages/dsh-kimi-tide",
      "candidateToken": "replacement-06-11b6262afa2d88ea78ed",
      "distributionClass": "direct-upstream-exact",
      "packageName": "dsh-kimi-tide",
      "packageVersion": "1.0.1",
      "rank": 6,
      "runtimeInput": null,
      "source": {
        "commit": "023d49d61c542bdb30016a9d4eb85a193d4d3da6",
        "exactCoordinate": "https://github.com/tafcear/kimi-tide/releases/download/v1.0.1/dsh-kimi-tide-1.0.1.tgz",
        "repository": "https://github.com/tafcear/kimi-tide.git",
        "sourceSubdir": "packages/dsh-kimi-tide",
        "tree": "6b715e08ddc486fb12abedb4dcada1abe23cea52"
      },
      "status": "runtime-input-pending"
    },
    {
      "candidateKey": "SuCriss/dsh-version-update",
      "candidateToken": "replacement-07-acca5e5c8feb0163b042",
      "distributionClass": "direct-upstream-exact",
      "packageName": "dsh-version-update",
      "packageVersion": "1.0.6",
      "rank": 7,
      "runtimeInput": null,
      "source": {
        "commit": "0805410a5db07836a1c85ea1c714c6430d36f95a",
        "exactCoordinate": "npm:dsh-version-update@1.0.6",
        "repository": "https://github.com/SuCriss/dsh-version-update.git",
        "sourceSubdir": ".",
        "tree": "2bee7e8514ea59c530c23cf9959400032ff9a681"
      },
      "status": "runtime-input-pending"
    },
    {
      "candidateKey": "squirrel20/dsh-cron",
      "candidateToken": "replacement-08-b22e96e971d6beff4e60",
      "distributionClass": "direct-upstream-exact",
      "packageName": "dsh-cron",
      "packageVersion": "0.12.1",
      "rank": 8,
      "runtimeInput": null,
      "source": {
        "commit": "f3f881bcdcd3bcdd6d2a34af63327c4eb795c86f",
        "exactCoordinate": "https://github.com/squirrel20/dsh-cron/releases/download/v0.12.1/dsh-cron.tgz",
        "repository": "https://github.com/squirrel20/dsh-cron.git",
        "sourceSubdir": ".",
        "tree": "e60eb1b41df84c7c52a7e3d4ff03a4b164d9c460"
      },
      "status": "runtime-input-pending"
    },
    {
      "candidateKey": "baisama-cloud/dsh-stt-input",
      "candidateToken": "replacement-09-8a8bfd08c5bdf9b28f6a",
      "distributionClass": "direct-upstream-exact",
      "packageName": "dsh-stt-input",
      "packageVersion": "0.1.0",
      "rank": 9,
      "runtimeInput": null,
      "source": {
        "commit": "2f751d5ea14a6bfa9513d4439a45880f4b7a97de",
        "exactCoordinate": "https://github.com/baisama-cloud/dsh-stt-input/releases/download/v0.1.0/dsh-stt-input-0.1.0.tgz",
        "repository": "https://github.com/baisama-cloud/dsh-stt-input.git",
        "sourceSubdir": ".",
        "tree": "5c6ed01a0e4a16cfea701a7c6a375e2f5a6019d6"
      },
      "status": "runtime-input-pending"
    },
    {
      "candidateKey": "Yu-tao-Li/dsh-reference-checker",
      "candidateToken": "replacement-10-2c1dc3b59b00657eac48",
      "distributionClass": "direct-upstream-exact",
      "packageName": "dsh-reference-checker",
      "packageVersion": "1.1.0",
      "rank": 10,
      "runtimeInput": null,
      "source": {
        "commit": "b6c1cf95937e4d19837702d1cd14f7679762a61e",
        "exactCoordinate": "npm:dsh-reference-checker@1.1.0",
        "repository": "https://github.com/Yu-tao-Li/dsh-reference-checker.git",
        "sourceSubdir": ".",
        "tree": "2937bc99e01901a04486f6e05906bd5545893ef4"
      },
      "status": "runtime-input-pending"
    },
    {
      "candidateKey": "kui123456789/dsh-codex-workflow",
      "candidateToken": "replacement-11-2ff14815084b64298ffc",
      "distributionClass": "direct-upstream-exact",
      "packageName": "dsh-codex-workflow",
      "packageVersion": "1.0.12",
      "rank": 11,
      "runtimeInput": null,
      "source": {
        "commit": "0be09fd3860254993f13ffdf8809131c67101f81",
        "exactCoordinate": "npm:dsh-codex-workflow@1.0.12",
        "repository": "https://github.com/kui123456789/dsh-codex-workflow.git",
        "sourceSubdir": ".",
        "tree": "810970d43eb1639e7d2063213040b4b38380b0a0"
      },
      "status": "runtime-input-pending"
    },
    {
      "candidateKey": "victorzhong0110/dsh-outcome-loop",
      "candidateToken": "replacement-12-11af3a541e11285acec0",
      "distributionClass": "direct-upstream-exact",
      "packageName": "dsh-outcome-loop",
      "packageVersion": "0.1.0-beta.8",
      "rank": 12,
      "runtimeInput": null,
      "source": {
        "commit": "4953d8cc4ee6da45753658a49ae91e9cd02b5e4c",
        "exactCoordinate": "https://github.com/victorzhong0110/dsh-outcome-loop/releases/download/v0.1.0-beta.8/dsh-outcome-loop-0.1.0-beta.8.tgz",
        "repository": "https://github.com/victorzhong0110/dsh-outcome-loop.git",
        "sourceSubdir": ".",
        "tree": "fb463a9b7de489046670ba8b048fd84fac8c85e8"
      },
      "status": "runtime-input-pending"
    },
    {
      "candidateKey": "zizhongfeiyang/dsh-settings-drawer",
      "candidateToken": "replacement-13-6a271385464e2c6146d1",
      "distributionClass": "direct-upstream-exact",
      "packageName": "dsh-settings-drawer",
      "packageVersion": "1.2.0",
      "rank": 13,
      "runtimeInput": null,
      "source": {
        "commit": "9482b9f53679ba50e1f94f07c2380b8345ad739a",
        "exactCoordinate": "https://github.com/zizhongfeiyang/dsh-settings-drawer/releases/download/v1.2.0/dsh-settings-drawer-1.2.0.tgz",
        "repository": "https://github.com/zizhongfeiyang/dsh-settings-drawer.git",
        "sourceSubdir": ".",
        "tree": "8ee67531dab123d5a885660c4e36cc05e7df5a38"
      },